<employees xmlns:xsi="http://www.w3.org/2001/XMLSchema-instance" xsi:noNamespaceSchemaLocation="Q1.xsd">
    <!--        
        Validate XML Q1.xsd com XML Schema
        (atalho netbeans12.3 ALT + Shift + f9)
    -->
    <employee number="1002">
        <lastName>Murphy</lastName>
        <firstName>Diane</firstName>
        <extension>x5800</extension>
        <email>dmurphy@classicmodelcars.com</email>
        <officeCode>1</officeCode>
        <jobTitle>President</jobTitle>
    </employee>
    <employee number="1056">
        <lastName>Patterson</lastName>
        <firstName>Mary</firstName>
        <extension>x4611</extension>
        <email>mpatterso@classicmodelcars.com</email>
        <officeCode>1</officeCode>
        <reportsTo>1002</reportsTo>
        <jobTitle>VP Sales</jobTitle>
    </employee>
    <employee number="1076">
        <lastName>Firrelli</lastName>
        <firstName>Jeff</firstName>
        <extension>x9273</extension>
        <email>jfirrelli@classicmodelcars.com</email>
        <officeCode>1</officeCode>
        <reportsTo>1002</reportsTo>
        <jobTitle>VP Marketing</jobTitle>
    </employee>
    <employee number="1088">
        <lastName>Patterson</lastName>
        <firstName>William</firstName>
        <extension>x4871</extension>
        <email>wpatterson@classicmodelcars.com</email>
        <officeCode>6</officeCode>
        <reportsTo>1056</reportsTo>
        <jobTitle>Sales Manager (APAC)</jobTitle>
    </employee>
    <employee number="1102">
        <lastName>Bondur</lastName>
        <firstName>Gerard</firstName>
        <extension>x5408</extension>
        <email>gbondur@classicmodelcars.com</email>
        <officeCode>4</officeCode>
        <reportsTo>1056</reportsTo>
        <jobTitle>Sale Manager (EMEA)</jobTitle>
    </employee>
    <employee number="1143">
        <lastName>Bow</lastName>
        <firstName>Anthony</firstName>
        <extension>x5428</extension>
        <email>abow@classicmodelcars.com</email>
        <officeCode>1</officeCode>
        <reportsTo>1056</reportsTo>
        <jobTitle>Sales Manager (NA)</jobTitle>
    </employee>
    <employee number="1165">
        <lastName>Jennings</lastName>
        <firstName>Leslie</firstName>
        <extension>x3291</extension>
        <email>ljennings@classicmodelcars.com</email>
        <officeCode>1</officeCode>
        <reportsTo>1143</reportsTo>
        <jobTitle>Sales Rep</jobTitle>
    </employee>
    <employee number="1166">
        <lastName>Thompson</lastName>
        <firstName>Leslie</firstName>
        <extension>x4065</extension>
        <email>lthompson@classicmodelcars.com</email>
        <officeCode>1</officeCode>
        <reportsTo>1143</reportsTo>
        <jobTitle>Sales Rep</jobTitle>
    </employee>
    <employee number="1188">
        <lastName>Firrelli</lastName>
        <firstName>Julie</firstName>
        <extension>x2173</extension>
        <email>jfirrelli@classicmodelcars.com</email>
        <officeCode>2</officeCode>
        <reportsTo>1143</reportsTo>
        <jobTitle>Sales Rep</jobTitle>
    </employee>
    <employee number="1216">
        <lastName>Patterson</lastName>
        <firstName>Steve</firstName>
        <extension>x4334</extension>
        <email>spatterson@classicmodelcars.com</email>
        <officeCode>2</officeCode>
        <reportsTo>1143</reportsTo>
        <jobTitle>Sales Rep</jobTitle>
    </employee>
    <employee number="1286">
        <lastName>Tseng</lastName>
        <firstName>Foon Yue</firstName>
        <extension>x2248</extension>
        <email>ftseng@classicmodelcars.com</email>
        <officeCode>3</officeCode>
        <reportsTo>1143</reportsTo>
        <jobTitle>Sales Rep</jobTitle>
    </employee>
    <employee number="1323">
        <lastName>Vanauf</lastName>
        <firstName>George</firstName>
        <extension>x4102</extension>
        <email>gvanauf@classicmodelcars.com</email>
        <officeCode>3</officeCode>
        <reportsTo>1143</reportsTo>
        <jobTitle>Sales Rep</jobTitle>
    </employee>
    <employee number="1337">
        <lastName>Bondur</lastName>
        <firstName>Loui</firstName>
        <extension>x6493</extension>
        <email>lbondur@classicmodelcars.com</email>
        <officeCode>4</officeCode>
        <reportsTo>1102</reportsTo>
        <jobTitle>Sales Rep</jobTitle>
    </employee>
    <employee number="1370">
        <lastName>Hernandez</lastName>
        <firstName>Gerard</firstName>
        <extension>x2028</extension>
        <email>ghernande@classicmodelcars.com</email>
        <officeCode>4</officeCode>
        <reportsTo>1102</reportsTo>
        <jobTitle>Sales Rep</jobTitle>
    </employee>
    <employee number="1401">
        <lastName>Castillo</lastName>
        <firstName>Pamela</firstName>
        <extension>x2759</extension>
        <email>pcastillo@classicmodelcars.com</email>
        <officeCode>4</officeCode>
        <reportsTo>1102</reportsTo>
        <jobTitle>Sales Rep</jobTitle>
    </employee>
    <employee number="1501">
        <lastName>Bott</lastName>
        <firstName>Larry</firstName>
        <extension>x2311</extension>
        <email>lbott@classicmodelcars.com</email>
        <officeCode>7</officeCode>
        <reportsTo>1102</reportsTo>
        <jobTitle>Sales Rep</jobTitle>
    </employee>
    <employee number="1504">
        <lastName>Jones</lastName>
        <firstName>Barry</firstName>
        <extension>x102</extension>
        <email>bjones@classicmodelcars.com</email>
        <officeCode>7</officeCode>
        <reportsTo>1102</reportsTo>
        <jobTitle>Sales Rep</jobTitle>
    </employee>
    <employee number="1611">
        <lastName>Fixter</lastName>
        <firstName>Andy</firstName>
        <extension>x101</extension>
        <email>afixter@classicmodelcars.com</email>
        <officeCode>6</officeCode>
        <reportsTo>1088</reportsTo>
        <jobTitle>Sales Rep</jobTitle>
    </employee>
    <employee number="1612">
        <lastName>Marsh</lastName>
        <firstName>Peter</firstName>
        <extension>x102</extension>
        <email>pmarsh@classicmodelcars.com</email>
        <officeCode>6</officeCode>
        <reportsTo>1088</reportsTo>
        <jobTitle>Sales Rep</jobTitle>
    </employee>
    <employee number="1619">
        <lastName>King</lastName>
        <firstName>Tom</firstName>
        <extension>x103</extension>
        <email>tking@classicmodelcars.com</email>
        <officeCode>6</officeCode>
        <reportsTo>1088</reportsTo>
        <jobTitle>Sales Rep</jobTitle>
    </employee>
    <employee number="1621">
        <lastName>Nishi</lastName>
        <firstName>Mami</firstName>
        <extension>x101</extension>
        <email>mnishi@classicmodelcars.com</email>
        <officeCode>5</officeCode>
        <reportsTo>1056</reportsTo>
        <jobTitle>Sales Rep</jobTitle>
    </employee>
    <employee number="1625">
        <lastName>Kato</lastName>
        <firstName>Yoshimi</firstName>
        <extension>x102</extension>
        <email>ykato@classicmodelcars.com</email>
        <officeCode>5</officeCode>
        <reportsTo>1621</reportsTo>
        <jobTitle>Sales Rep</jobTitle>
    </employee>
    <employee number="1702">
        <lastName>Gerard</lastName>
        <firstName>Martin</firstName>
        <extension>x2312</extension>
        <email>mgerard@classicmodelcars.com</email>
        <officeCode>4</officeCode>
        <reportsTo>1102</reportsTo>
        <jobTitle>Sales Rep</jobTitle>
    </employee>
</employees>
